{
  "name": "Takaro Official Registry",
  "description": "Modules made and reviewed by the Takaro team.",
  "legacyModuleNames": [
    "utils",
    "teleports",
    "playerOnboarding",
    "serverMessages",
    "chatBridge",
    "gimme",
    "highPingKicker",
    "economyUtils",
    "lottery",
    "geoBlock",
    "timedShutdown",
    "dailyRewards",
    "shopActions"
  ],
  "unlisted": {
    "hello-world": "Example module for module authors",
    "casino": "Held until it has tests",
    "buff-manager": "Held until it has tests"
  }
}
